Item name,Price
Open Secret Celebration Gift Box,Rs. 245
Cadbury Bournvita Biscuit,Rs. 90
Karachi Bakery Cashew Bakery Cookies,Rs. 210
Karachi Bakery Fruit Bakery Cookies,Rs. 190
Open Secret Almond Nutty Chocolate Cookies + Open Secret Choco Almond Butter Baked Nutty Chips Combo,Rs. 109
Open Secret Almond Nutty Chocolate Cookies + Open Secret Lemon Chilli Almond Butter Baked Nutty Chips Combo,Rs. 109
Open Secret Almond Nutty Chocolate Cookies + Open Secret Spicy Peanut Butter Baked Nutty Chips Combo,Rs. 109
Open Secret Assorted Nutty Chocolate Cookies + Open Secret Choco Almond Butter Baked Nutty Chips Combo,Rs. 109
Open Secret Assorted Nutty Chocolate Cookies + Open Secret Lemon Chilli Almond Butter Baked Nutty Chips Combo,Rs. 109
Open Secret Assorted Nutty Chocolate Cookies + Open Secret Spicy Peanut Butter Baked Nutty Chips Combo,Rs. 109
Britannia Good Day Butter Cookies - Buy 4 Get 1 Free,Rs. 100
Sunfeast Mom's Magic Rich Butter Cookies - Pack of 2,Rs. 54
"Open Secret Assorted Chocolate Cookies - Choco Almonds, White Choco Cashews & Peanuts Butter - Pack of 2",Rs. 168
"Open Secret Assorted Chocolate Cookies - Choco Almonds, White Choco Cashews & Peanuts Butter",Rs. 90
Unibic Cashew Badam Cookies,Rs. 79
Unibic Choco Nut Cookies,Rs. 107
Sunfeast Mom's Magic Biscuit - Cashew & Almond Cookies 600 g,Rs. 100
Sunfeast Mom's Magic Biscuit - Cashew & Almond Cookies 200 g - Pack of 2,Rs. 72
Sunfeast Dark Fantasy Desserts Choconut Dipped Cookies - Pack of 2,Rs. 119
Open Secret Chocolate Almond Cookies - Pack of 2,Rs. 168
